{
  "schema_version": 1,
  "kind": "agent_task",
  "task_id": "task-6854-green-ci-abc123",
  "snapshot_id": "gh-snapshot-2026-04-26T18:40:00Z",
  "lane": "green_ci",
  "pr": 6854,
  "head_sha": "abc123",
  "base_sha": "def456",
  "allowed_mutations": ["emit_receipt", "comment"],
  "forbidden_mutations": ["apply_labels", "merge", "push_branch"],
  "expires_at": "2026-04-26T19:10:00Z"
}
